{
  "$schema": "../../schemas/place.schema.json",
  "id": "new-place",
  "kind": "place",
  "name": "New place",
  "summary": "One sentence: what it is and why it matters.",
  "trust": "unconfirmed",
  "sources": [
    "tay"
  ],
  "last_updated": "2026-10-27",
  "region": "first-village",
  "features": [
    "What is here."
  ]
}
