{
  "id": "vampire-castle",
  "kind": "place",
  "name": "Vampire Castle",
  "summary": "Where vampires spawn, and where they shelter from the sun.",
  "trust": "unconfirmed",
  "sources": [
    "wiki-map",
    "wiki-items",
    "wiki-beginner-guide"
  ],
  "last_updated": "2026-10-27",
  "features": [
    "Indoors, safe from the sun."
  ],
  "map": {
    "x": 77.9,
    "y": 23.4
  },
  "pin": "base"
}
