{
  "id": "second-village",
  "kind": "place",
  "name": "Second Village",
  "summary": "The second village, home of the weaponsmith and the forge.",
  "trust": "unconfirmed",
  "sources": [
    "wiki-map",
    "wiki-items",
    "wiki-mining"
  ],
  "last_updated": "2026-10-27",
  "map": {
    "x": 57.7,
    "y": 70.4
  },
  "pin": "village"
}
