{
  "id": "hunters-lv2000",
  "kind": "place",
  "name": "Hunter grounds (Lv 2,000)",
  "summary": "Where hunter NPCs of about Lv 2,000 roam.",
  "trust": "unconfirmed",
  "sources": [
    "wiki-map"
  ],
  "last_updated": "2026-10-27",
  "map": {
    "x": 19.4,
    "y": 13.9
  },
  "pin": "enemies"
}
